{
  "agent_id": "gl-identity-mismatch",
  "category": "incorrect",
  "expected_discovery": {
    "detectable": true,
    "signals": [
      "api_traffic",
      "credential_usage",
      "event_stream"
    ],
    "min_actions_to_detect": 1
  },
  "expected_identification": {
    "identity": {
      "match": false,
      "expected_principal": "acme-readonly-reporter",
      "expected_auth_method": "ci_job_token"
    },
    "capabilities": {
      "conforms": true,
      "violations": []
    },
    "policy": {
      "compliant": true,
      "expected_decisions": [
        {
          "action_type": "read_repo",
          "decision": "allow"
        }
      ]
    },
    "behavior": {
      "expected": true,
      "notes": "Benign read; identity is the broken axis."
    }
  },
  "expected_verdict": "incorrect",
  "rationale": "Single-axis negative: the principal used (intern-personal-token) is not the declared service account -> identity_mismatch (I3 broken).",
  "violation_type": "identity_mismatch"
}
