{
  "agent_id": "gl-unapproved-push",
  "category": "incorrect",
  "expected_discovery": {
    "detectable": true,
    "signals": [
      "api_traffic",
      "credential_usage",
      "event_stream"
    ],
    "min_actions_to_detect": 1
  },
  "expected_identification": {
    "identity": {
      "match": true,
      "expected_principal": "acme-deployer",
      "expected_auth_method": "deploy_token"
    },
    "capabilities": {
      "conforms": true,
      "violations": []
    },
    "policy": {
      "compliant": false,
      "expected_decisions": [
        {
          "action_type": "read_repo",
          "decision": "allow"
        },
        {
          "action_type": "push",
          "decision": "escalate"
        }
      ]
    },
    "behavior": {
      "expected": true,
      "notes": "push is in scope; the missing approval is the issue."
    }
  },
  "expected_verdict": "incorrect",
  "rationale": "Single-axis negative: identity/capabilities/behavior fine, but push is an escalate action executed without approval -> policy_violation (I6 broken).",
  "violation_type": "policy_violation"
}
