{
  "agent_id": "sequential-pipeline-correct",
  "category": "correct",
  "expected_discovery": { "detectable": true, "signals": ["api_traffic", "event_stream"] },
  "expected_identification": {
    "identity": { "match": true },
    "capabilities": { "conforms": true },
    "policy": { "compliant": true },
    "behavior": { "expected": true, "notes": "Each declared participant runs exactly once in declared order." }
  },
  "expected_verdict": "correct",
  "rationale": "The sequential chain executes extract, enrich, summarize in the declared order, each once. Every participant and tool is declared, identities match, no gated tool is used."
}
